search_position,name,curr_price,orig_price,num_sold,in_stock,num_installments,amt_installments,arrival_time,shipping,free_return,free_return_info,review_avg,num_reviews,seller_link,product_link,five_star,four_star,three_star,two_star,one_star,item_id,Marca,Línea,Modelo,Formato
501, Audifonos Bluetooth Manos Libre Hbs-740 Negro-blanco-rosado ,43,NA,1,99,NA,NA,NA,Entrega a acordar con el vendedor,NA,NA,NA,NA,http://perfil.mercadolibre.com.pe/PLAZATECH,https://articulo.mercadolibre.com.pe/MPE-426416832-audifonos-bluetooth-manos-libre-hbs-740-negro-blanco-rosado-_JM,NA,NA,NA,NA,NA,#426416832,NA,NA,NA,NA
502, Audifono Bluetooth Bluedio I4 Intercambiables Negro ,55,NA,12,888,NA,NA,NA,Entrega a acordar con el vendedor,NA,NA,5,2,http://perfil.mercadolibre.com.pe/MEGARICKHUNTER,https://articulo.mercadolibre.com.pe/MPE-419519322-audifono-bluetooth-bluedio-i4-intercambiables-negro-_JM,2,0,0,0,0,#419519322,Bluedio,NA,NA,NA
503, Audífonos Bluetooth Jbl T110bt / Tienda / Mercadopago ,154,NA,0,1000,NA,NA,NA,Entrega a acordar con el vendedor,NA,NA,NA,NA,http://perfil.mercadolibre.com.pe/IMANIA.PERU,https://articulo.mercadolibre.com.pe/MPE-435465004-audifonos-bluetooth-jbl-t110bt-tienda-mercadopago-_JM,NA,NA,NA,NA,NA,#435465004,JBL,NA,T110BT,NA
504, Audífonos Bluetooth Klip Xtreme Khs-620bk Con Micrófono ,55,NA,3,5,NA,NA,NA,Entrega a acordar con el vendedor,NA,NA,NA,NA,http://perfil.mercadolibre.com.pe/ELECSERVICE,https://articulo.mercadolibre.com.pe/MPE-427028296-audifonos-bluetooth-klip-xtreme-khs-620bk-con-microfono-_JM,NA,NA,NA,NA,NA,#427028296,NA,NA,NA,NA
505, Audifono Bluetooth Auricular Inalambrico Y Alambrico Hanfree ,69,NA,1,19,NA,NA,NA,Entrega a acordar con el vendedor,NA,NA,NA,NA,http://perfil.mercadolibre.com.pe/IMPORTACIONES+LAKSHMI,https://articulo.mercadolibre.com.pe/MPE-431691765-audifono-bluetooth-auricular-inalambrico-y-alambrico-hanfree-_JM,NA,NA,NA,NA,NA,#431691765,NA,NA,NA,NA
506, Audifonos Bluetooth I9s. Version 5.0. Delivery Gratis ,59,NA,0,10,NA,NA,NA,Envío gratis a todo el país,NA,NA,NA,NA,http://perfil.mercadolibre.com.pe/HANNZOTIENDAONLINE,https://articulo.mercadolibre.com.pe/MPE-436911017-audifonos-bluetooth-i9s-version-50-delivery-gratis-_JM,NA,NA,NA,NA,NA,#436911017,NA,NA,NA,NA
507, Audífono Handfree Stereo Bluetooth V4.1 - Llamadas Y Musica ,19,NA,146,90448,NA,NA,NA,Entrega a acordar con el vendedor,NA,NA,4,2,http://perfil.mercadolibre.com.pe/PRECIO.PE,https://articulo.mercadolibre.com.pe/MPE-421823791-audifono-handfree-stereo-bluetooth-v41-llamadas-y-musica-_JM,0,2,0,0,0,#421823791,NA,NA,NA,NA
508, Lentes De Sol Con Audifonos Bluetooth + 2 Cambios Gratis ,120,NA,5,3,NA,NA,NA,Entrega a acordar con el vendedor,NA,NA,5,1,http://perfil.mercadolibre.com.pe/SHAVELI,https://articulo.mercadolibre.com.pe/MPE-428053220-lentes-de-sol-con-audifonos-bluetooth-2-cambios-gratis-_JM,1,0,0,0,0,#428053220,NA,NA,NA,NA
509, Audifono Bluetooth Bluedio I4 Intercambiables Colores ,55,NA,45,855,NA,NA,NA,Entrega a acordar con el vendedor,NA,NA,5,2,http://perfil.mercadolibre.com.pe/MEGARICKHUNTER,https://articulo.mercadolibre.com.pe/MPE-418894438-audifono-bluetooth-bluedio-i4-intercambiables-colores-_JM,2,0,0,0,0,#418894438,Bluedio,NA,NA,NA
510, Audifono Bluetooth Tws I80 ,140,NA,0,5,NA,NA,NA,Entrega a acordar con el vendedor,NA,NA,NA,NA,http://perfil.mercadolibre.com.pe/MAJU4927724,https://articulo.mercadolibre.com.pe/MPE-437348784-audifono-bluetooth-tws-i80-_JM,NA,NA,NA,NA,NA,#437348784,NA,NA,NA,NA
511, Skullcandy Audifonos Crusher Wireless Bass Sound Bluetooth ,379,NA,1,105,NA,NA,NA,Entrega a acordar con el vendedor,NA,NA,NA,NA,http://perfil.mercadolibre.com.pe/DLECTRO,https://articulo.mercadolibre.com.pe/MPE-436811342-skullcandy-audifonos-crusher-wireless-bass-sound-bluetooth-_JM,NA,NA,NA,NA,NA,#436811342,NA,NA,NA,NA
512, Audífonos Bluetooth E1c Tipo AirPods Sin Cables Stereo Rojo ,49,NA,2,898,NA,NA,NA,Entrega a acordar con el vendedor,NA,NA,NA,NA,http://perfil.mercadolibre.com.pe/MEGARICKHUNTER,https://articulo.mercadolibre.com.pe/MPE-433207017-audifonos-bluetooth-e1c-tipo-airpods-sin-cables-stereo-rojo-_JM,NA,NA,NA,NA,NA,#433207017,Beneve,NA,NA,NA
513, Audífonos Bluetooth Soundcore Space Nc ,599,NA,NA,NA,NA,NA,NA,Entrega a acordar con el vendedor,NA,NA,NA,NA,http://perfil.mercadolibre.com.pe/ANKER+PERU?brandId=144,https://articulo.mercadolibre.com.pe/MPE-434540812-audifonos-bluetooth-soundcore-space-nc-_JM,NA,NA,NA,NA,NA,#434540812,NA,NA,NA,NA
514, Audífonos Bluetooth E1c Tipo AirPods Sin Cables Stereo Azul ,49,NA,1,899,NA,NA,NA,Entrega a acordar con el vendedor,NA,NA,NA,NA,http://perfil.mercadolibre.com.pe/MEGARICKHUNTER,https://articulo.mercadolibre.com.pe/MPE-433206977-audifonos-bluetooth-e1c-tipo-airpods-sin-cables-stereo-azul-_JM,NA,NA,NA,NA,NA,#433206977,beneve,NA,NA,NA
515, Jbl Audifonos Bluetooth T110bt - Colores + 1 Año Garantía ,168,NA,0,5,NA,NA,NA,Entrega a acordar con el vendedor,NA,NA,NA,NA,http://perfil.mercadolibre.com.pe/MF+TECHNOLOGIES,https://articulo.mercadolibre.com.pe/MPE-429711764-jbl-audifonos-bluetooth-t110bt-colores-1-ano-garantia-_JM,NA,NA,NA,NA,NA,#429711764,JBL,NA,T110BT - El precio incluye el envío a domicilio u oficina - Lima Metropolitana.,NA
516, Audifonos I11s Plus Bluetooth 5.0 Inalambricos Android ,69,NA,26,74,NA,NA,NA,Entrega a acordar con el vendedor,NA,NA,NA,NA,http://perfil.mercadolibre.com.pe/REIMERRAMOSURDANETA,https://articulo.mercadolibre.com.pe/MPE-430336098-audifonos-i11s-plus-bluetooth-50-inalambricos-android-_JM,NA,NA,NA,NA,NA,#430336098,Apple,NA,NA,NA
517," Audifonos Auriculares, Maxell Solid Azul Bluetooth iPhone ",75,NA,1,19,NA,NA,NA,Entrega a acordar con el vendedor,NA,NA,NA,NA,http://perfil.mercadolibre.com.pe/USA_EN_PERU_2018,https://articulo.mercadolibre.com.pe/MPE-428848696-audifonos-auriculares-maxell-solid-azul-bluetooth-iphone-_JM,NA,NA,NA,NA,NA,#428848696,Maxell,NA,NA,NA
518, Audifonos Bluetooth Skullcandy Inkd Wireless Negro Sellado ,149,NA,1,4,NA,NA,NA,Entrega a acordar con el vendedor,NA,NA,NA,NA,http://perfil.mercadolibre.com.pe/CIROXELECTRONIC,https://articulo.mercadolibre.com.pe/MPE-435632447-audifonos-bluetooth-skullcandy-inkd-wireless-negro-sellado-_JM,NA,NA,NA,NA,NA,#435632447,Skullcandy,NA,INK'D Wireless,NA
519, Auricular Bluetooth V42 Llamadas Inalambricos Negocios Nuevo ,215,NA,1,11,NA,NA,NA,Entrega a acordar con el vendedor,NA,NA,NA,NA,http://perfil.mercadolibre.com.pe/NEGOCIOS+DANTE1920,https://articulo.mercadolibre.com.pe/MPE-436366312-auricular-bluetooth-v42-llamadas-inalambricos-negocios-nuevo-_JM,NA,NA,NA,NA,NA,#436366312,FLINEVE,NA,NA,NA
520, Bluenin Bbh919s Auriculares Bluetooth Inalambricos Retractil ,234,NA,0,12,NA,NA,NA,Entrega a acordar con el vendedor,NA,NA,NA,NA,http://perfil.mercadolibre.com.pe/NEGOCIOS+DANTE1920,https://articulo.mercadolibre.com.pe/MPE-436366290-bluenin-bbh919s-auriculares-bluetooth-inalambricos-retractil-_JM,NA,NA,NA,NA,NA,#436366290,BLUENIN,NA,NA,NA
521," Audifono Ewtto Con Bluetooth,micro,sd,por Mayor(leer Rangos) ",34,NA,5,95,NA,NA,NA,Entrega a acordar con el vendedor,NA,NA,NA,NA,http://perfil.mercadolibre.com.pe/EL+RINCONDELCOCO,https://articulo.mercadolibre.com.pe/MPE-427263494-audifono-ewtto-con-bluetoothmicrosdpor-mayorleer-rangos-_JM,NA,NA,NA,NA,NA,#427263494,Ewtto,NA,NA,NA
522, Audifonos Inalambrios Bluetooth Imantados Deportivos 2018 ,39,NA,0,39,NA,NA,NA,Envío gratis a todo el país,NA,NA,NA,NA,http://perfil.mercadolibre.com.pe/CIROXELECTRONIC,https://articulo.mercadolibre.com.pe/MPE-436498368-audifonos-inalambrios-bluetooth-imantados-deportivos-2018-_JM,NA,NA,NA,NA,NA,#436498368,NA,NA,NA,NA
523, Audífonos Bluetooth Plextone Bx343 Envío Internacional! ,109,NA,1,64,NA,NA,NA,Envío gratis a todo el país,NA,NA,NA,NA,http://perfil.mercadolibre.com.pe/PKIMPORTS+TIENDAVIRTUAL,https://articulo.mercadolibre.com.pe/MPE-432343154-audifonos-bluetooth-plextone-bx343-envio-internacional-_JM,NA,NA,NA,NA,NA,#432343154,Plextone,bluetooth,BX343,Neckband
524, Auriculares Bluetooth Hoco Es20 Con Control Táctil ,260,NA,0,NA,NA,NA,NA,Entrega a acordar con el vendedor,NA,NA,NA,NA,http://perfil.mercadolibre.com.pe/LUCIANATZ,https://click1.mercadolibre.com.pe/mclics/clicks/external/MPE/count?a=LPovY9X5bgNQY6PZrRSZ3zYWWz3JCKfO4NDRTYTB9%2Fule1eN6Tazm6FPY%2BsWm1ohBWxs9KRrAWf%2FySVFN5cCa1f%2B3NCrHtw2Yp%2BOYjpSgzGqbJK8aiaqAME7lxex2%2F2hKIwfPwZTuekZV9bdD2Y5Wby47CsSyDZiEplk%2FC%2BkPHRwlkM1%2BUNjlEBY2%2BWg3kHe5SKFMYKo90%2BFUJOenP9M5FPptfrN7xrbcvzy932IpZLEdsOTuhzuxV9aOU51zZ%2Fx419%2BJR16rOE1jT6dwug6G6zUnFchufIPYswPrTm%2BpS7Z%2F9raElw4cGcbUEgmxKjDhWqqTbU4I3cTYEVkQ338oHOyppDV%2BoRWgeUpIkJnZsY9X3ytZsth45L%2Ft6eq201nGV2a9sm%2BKa9QcMqT93G8QuX9BdkbU6CvOzMLKJPvhhM%2BUOdumtmx1ouAJf6pjK3th2cH7fcoi8Z42t6cunNNkab9atkw36K%2FMRBSPjfCDkwiEWpjlSGOdd9Roca%2Br%2BooYRAkJHmzDviEzrvwlUfFCZpB2Re1G7d4%2FC9IJicLVmkaMdGq88xvJB6P6BqKf%2F4AGezwu6lFE3qDoJ7TQudLAlMNX3He6BzoZ3Qo4%2F9p2%2BGoSkx0rmH8pweKtFees4R%2BadBwtdtr59otDn4JDfeS4E9YRTA5p6VhFcgAnXXiS1VfSUFXurZKcrQqWjtY255nzUj5Kz7app6hzCv2w2AK%2Bf20G4uRx%2FMnmVzpWHXew64rmueu6T0WR9%2F7jcoLDFCTultFyYUs3zSc%2B%2BUh8eKiDhmvxozz2TM5mLcPJmqNieZ5xQCr7EiIuFkkbIMAjR%2FAPtvu2y244JyIM3ucvAqwcAzotl6uJvFaWdMFZtCsLzqe52OLejVXBmoFtA3NJLoeBTk1OTsHmMK4yNxsX74lhhNbIdKwh4ZN5IGHnXLnKEGcK61zmlfZnlp93GDfX5M7UlPAhLpA3xlI9VJeZCUzuKSi63KPKktavevDF%2FOveCf3OeSFnbE3Lb3d5CdNOXVJKAIal7dqeByubQOS3x38OURASF5wdBJDS9l8gdYAWsYw%2FpFooeduBtQfZ%2FgOEEW%2B4lmyRgNLT3cvHKo0qnAICEGw1bDc4jJOo1UU057gTaD48rHA8JZpRn3CyfyzoV%2F0%2BwVJJsA1UHlBOQ7ubv6QeJcHtCGIr%2BYUCKHD8Yhb1oxo8DEYtkozlKjpxSq132%2Fm8JyfvghlVZw6q1PSmdqG8xD%2FMmUSmYq0V0SUpO5n3AaEdgdyxUoRNfMcVLsF6wAuLChSm2gEUILHw1F%2F7mgaWCo9h4UJ2D4e8rC1ZR1bVsIHrJW41usGlyjZ1sfv%2BEnrBce64cKD3lO3%2Fhor9tlY2aZytuKvGCAWitiZ6Tvkigfv5rA7zlAPMW6yu8vAnNPc99v8di%2FrrC2ROTSAxicaWgsBIotGxJ6UHVfwp4zedIEwOFcXpBe27Gy2iRwI4Ac45PHvO%2FBZt2dofNV1R6uRpbCFtaJwwTiyDuzZ7WlCimxZcD9qakjbEQQwbY%2BQ0CLAh4VPoJ1pgqQQcXF3Jowec%2FbZM%2B8uS8LRlcSobflHOoyeoz2AHi3hoPieacMo1OeAJ0%2BEo3MMw6DCjptt1kktwIVgzsocTQE0%2FA%3D%3D,NA,NA,NA,NA,NA,#437431728,NA,NA,NA,NA
525, Mini Audifonos Bluetooh Precio Por Mayor Envio Provincia ,20,NA,79,15,NA,NA,NA,Entrega a acordar con el vendedor,NA,NA,NA,NA,http://perfil.mercadolibre.com.pe/REVOLLEDO2323,https://articulo.mercadolibre.com.pe/MPE-433113833-mini-audifonos-bluetooh-precio-por-mayor-envio-provincia-_JM,NA,NA,NA,NA,NA,#433113833,NA,NA,NA,NA
526, Audífonos Inalámbricos Bluetooth I7s Tws ,40,NA,0,20,NA,NA,NA,Entrega a acordar con el vendedor,NA,NA,NA,NA,http://perfil.mercadolibre.com.pe/LEVEL-STORE,https://articulo.mercadolibre.com.pe/MPE-434528653-audifonos-inalambricos-bluetooth-i7s-tws-_JM,NA,NA,NA,NA,NA,#434528653,NA,NA,NA,NA
527, Audífonos Xiaomi Redmi Airdots ,110,NA,1,20,NA,NA,NA,Envío gratis a todo el país,NA,NA,4.6,85,http://perfil.mercadolibre.com.pe/LEJH6752873,https://articulo.mercadolibre.com.pe/MPE-436995977-audifonos-xiaomi-redmi-airdots-_JM,58,23,4,0,0,#436995977,Xiaomi,Mi,AirDots,In-ear
528, Audifonos Inalambricos Bluetooth Deportivos-no Beats S/25.00 ,25,NA,10,87,NA,NA,NA,Entrega a acordar con el vendedor,NA,NA,NA,NA,http://perfil.mercadolibre.com.pe/MERCADOPAGOPERU,https://articulo.mercadolibre.com.pe/MPE-435030551-audifonos-inalambricos-bluetooth-deportivos-no-beats-s2500-_JM,NA,NA,NA,NA,NA,#435030551,NA,NA,NA,NA
529, Audifonos Bluetooth - Handsfree Llamadas + Música ,24,NA,84,26,NA,NA,NA,Entrega a acordar con el vendedor,NA,NA,4.3,6,http://perfil.mercadolibre.com.pe/NIKO+SALAS,https://articulo.mercadolibre.com.pe/MPE-428201787-audifonos-bluetooth-handsfree-llamadas-musica-_JM,3,2,1,0,0,#428201787,NA,NA,NA,NA
530, Audifonos Planos Recargables Inalambrico Bluetooth Imantados ,18,NA,0,345,NA,NA,NA,Entrega a acordar con el vendedor,NA,NA,NA,NA,http://perfil.mercadolibre.com.pe/VMC+SOLUCIONES,https://articulo.mercadolibre.com.pe/MPE-436916044-audifonos-planos-recargables-inalambrico-bluetooth-imantados-_JM,NA,NA,NA,NA,NA,#436916044,NA,NA,NA,NA
531, Mini Audifono Bluetooth Inalambrico 4.0 Microfono Dlectro ,19,NA,1,599,NA,NA,NA,Entrega a acordar con el vendedor,NA,NA,NA,NA,http://perfil.mercadolibre.com.pe/WWW.DLECTRO.COM,https://articulo.mercadolibre.com.pe/MPE-432835775-mini-audifono-bluetooth-inalambrico-40-microfono-dlectro-_JM,NA,NA,NA,NA,NA,#432835775,NA,NA,NA,NA
532, Audífonos Auriculares Deportivo Bluetooth Headset Fajueze F2 ,49,NA,0,99,NA,NA,NA,Entrega a acordar con el vendedor,NA,NA,NA,NA,http://perfil.mercadolibre.com.pe/SPORTECH+BALHER,https://articulo.mercadolibre.com.pe/MPE-432206024-audifonos-auriculares-deportivo-bluetooth-headset-fajueze-f2-_JM,NA,NA,NA,NA,NA,#432206024,NA,NA,NA,NA
533, Audífonos Bluetooth Bluedio Turbine H+ ,130,NA,8,NA,NA,NA,NA,Entrega a acordar con el vendedor,NA,NA,NA,NA,http://perfil.mercadolibre.com.pe/ALKA+CORP,https://articulo.mercadolibre.com.pe/MPE-422875012-audifonos-bluetooth-bluedio-turbine-h-_JM,NA,NA,NA,NA,NA,#422875012,Bluedio,NA,H+,NA
534, 2019 Nuevo Audifono Razer Hammerhead Bt Wireless Black/green ,374,NA,1,985,NA,NA,NA,Entrega a acordar con el vendedor,NA,NA,NA,NA,http://perfil.mercadolibre.com.pe/ENERGYZONE_MIRAFLORES,https://articulo.mercadolibre.com.pe/MPE-433068718-2019-nuevo-audifono-razer-hammerhead-bt-wireless-blackgreen-_JM,NA,NA,NA,NA,NA,#433068718,Razer,Hammerhead,Hammerhead BT,NA
535, Auricular Bluetooth Halion (ha-s80 Sport) ,81,NA,1,9,NA,NA,NA,Entrega a acordar con el vendedor,NA,NA,NA,NA,http://perfil.mercadolibre.com.pe/HUANCAYOVENDE.COM,https://articulo.mercadolibre.com.pe/MPE-436372235-auricular-bluetooth-halion-ha-s80-sport-_JM,NA,NA,NA,NA,NA,#436372235,NA,NA,NA,NA
536, Audífono Hands Free Bluetooth Inalambricos Bluedio N2 Oferta ,39,NA,54,46,NA,NA,NA,Entrega a acordar con el vendedor,NA,NA,2,1,http://perfil.mercadolibre.com.pe/IMPORTACIONES+FLYTEC,https://articulo.mercadolibre.com.pe/MPE-420136134-audifono-hands-free-bluetooth-inalambricos-bluedio-n2-oferta-_JM,0,0,0,1,0,#420136134,Bluedio,NA,NA,NA
537, Auriculares Inalambricos Bluetooth Con Cancelacion De Ruido ,220,NA,0,12,NA,NA,NA,Entrega a acordar con el vendedor,NA,NA,NA,NA,http://perfil.mercadolibre.com.pe/NEGOCIOS+DANTE1920,https://articulo.mercadolibre.com.pe/MPE-436366500-auriculares-inalambricos-bluetooth-con-cancelacion-de-ruido-_JM,NA,NA,NA,NA,NA,#436366500,NEWCOS,NA,NA,NA
538, G-mobile - Auricular Bluetooth 4.1 Blanco ,19,27,29,19,NA,NA,NA,Entrega a acordar con el vendedor,NA,NA,NA,NA,NA,https://articulo.mercadolibre.com.pe/MPE-429868274-g-mobile-auricular-bluetooth-41-blanco-_JM,NA,NA,NA,NA,NA,#429868274,NA,NA,NA,NA
539, Audífonos Bluetooth Qcy Qs2 Tws 2da Generación ,149,NA,0,10,NA,NA,NA,Entrega a acordar con el vendedor,NA,NA,NA,NA,http://perfil.mercadolibre.com.pe/PULSE+TEC,https://articulo.mercadolibre.com.pe/MPE-437314789-audifonos-bluetooth-qcy-qs2-tws-2da-generacion-_JM,NA,NA,NA,NA,NA,#437314789,NA,NA,NA,NA
540, Sony Audifonos Bluetooth Cancelación D Ruido Wh-1000xm3 2019 ,1589,NA,0,2,NA,NA,NA,Entrega a acordar con el vendedor,NA,NA,NA,NA,http://perfil.mercadolibre.com.pe/FULL+NOVEDADES-,https://articulo.mercadolibre.com.pe/MPE-436602718-sony-audifonos-bluetooth-cancelacion-d-ruido-wh-1000xm3-2019-_JM,NA,NA,NA,NA,NA,#436602718,NA,NA,NA,NA
541, Audifonos Bluetooth Mpow Flame Ipx7 A Prueba De Agua ,140,NA,1,4,NA,NA,NA,Entrega a acordar con el vendedor,NA,NA,NA,NA,http://perfil.mercadolibre.com.pe/ANDREUS+STORE,https://articulo.mercadolibre.com.pe/MPE-435364478-audifonos-bluetooth-mpow-flame-ipx7-a-prueba-de-agua-_JM,NA,NA,NA,NA,NA,#435364478,Mpow,NA,NA,NA
542, Audifonos Qyc Bluetooth Qs1 3d Stereo Con Micrófono Dual ,94,NA,0,12,NA,NA,NA,Entrega a acordar con el vendedor,NA,NA,NA,NA,http://perfil.mercadolibre.com.pe/ROJU7443765,https://articulo.mercadolibre.com.pe/MPE-436239378-audifonos-qyc-bluetooth-qs1-3d-stereo-con-microfono-dual-_JM,NA,NA,NA,NA,NA,#436239378,NA,NA,NA,NA
543, Audifonos AirPods Apple Bluetooth Nuevo Sellado Original ,699,796,0,999,NA,NA,NA,Entrega a acordar con el vendedor,NA,NA,5,40,http://perfil.mercadolibre.com.pe/TECHNOW+1,https://articulo.mercadolibre.com.pe/MPE-433734344-audifonos-airpods-apple-bluetooth-nuevo-sellado-original-_JM,38,2,0,0,0,#433734344,Apple,NA,AirPods,In-ear
544, Audifono Jbl Bluetooth Pure Bass Sound T110 Bt Wireless ,129,NA,2,18,NA,NA,NA,Entrega a acordar con el vendedor,NA,NA,5,1,http://perfil.mercadolibre.com.pe/FULL+NOVEDADES-,https://articulo.mercadolibre.com.pe/MPE-435128971-audifono-jbl-bluetooth-pure-bass-sound-t110-bt-wireless-_JM,1,0,0,0,0,#435128971,JBL,NA,T110,NA
545, Motorola - Auricular Bluetooth Hk115 ,99,NA,1,49,NA,NA,NA,Entrega a acordar con el vendedor,NA,NA,NA,NA,NA,https://articulo.mercadolibre.com.pe/MPE-436997432-motorola-auricular-bluetooth-hk115-_JM,NA,NA,NA,NA,NA,#436997432,Motorola,NA,HK115,Clip-ear
546, Auriculares Avengers Bluetooth Niño Inalambricos Recargable ,279,NA,0,12,NA,NA,NA,Entrega a acordar con el vendedor,NA,NA,NA,NA,http://perfil.mercadolibre.com.pe/NEGOCIOS+DANTE1920,https://articulo.mercadolibre.com.pe/MPE-436365777-auriculares-avengers-bluetooth-nino-inalambricos-recargable-_JM,NA,NA,NA,NA,NA,#436365777,Ekids,NA,NA,NA
547, Audifonos Samsung Level U Pro Bluetooth ,220,NA,0,3,NA,NA,NA,Entrega a acordar con el vendedor,NA,NA,NA,NA,http://perfil.mercadolibre.com.pe/OSCAR-MANUEL,https://articulo.mercadolibre.com.pe/MPE-434111817-audifonos-samsung-level-u-pro-bluetooth-_JM,NA,NA,NA,NA,NA,#434111817,Samsung,NA,LEVEL U PRO,NA
548, G-mobile - Auricular Bluetooth 3.0 Negro ,79,NA,10,50,NA,NA,NA,Entrega a acordar con el vendedor,NA,NA,NA,NA,NA,https://articulo.mercadolibre.com.pe/MPE-430594728-g-mobile-auricular-bluetooth-30-negro-_JM,NA,NA,NA,NA,NA,#430594728,NA,NA,NA,NA
549, Audifonos Bluetooth Inalambricos ,55,NA,0,NA,NA,NA,NA,Entrega a acordar con el vendedor,NA,NA,NA,NA,http://perfil.mercadolibre.com.pe/VANESAELGUERA,https://articulo.mercadolibre.com.pe/MPE-435139471-audifonos-bluetooth-inalambricos-_JM,NA,NA,NA,NA,NA,#435139471,NA,NA,NA,NA
550, Audifonos Bluetooth Bluedio Tn2 Hifi Cancelación De Ruido ,79,NA,1,3,NA,NA,NA,Entrega a acordar con el vendedor,NA,NA,NA,NA,http://perfil.mercadolibre.com.pe/KINGDOM-STORE,https://articulo.mercadolibre.com.pe/MPE-435421563-audifonos-bluetooth-bluedio-tn2-hifi-cancelacion-de-ruido-_JM,NA,NA,NA,NA,NA,#435421563,Bluedio,NA,NA,NA
551," Audífonos Bluetooth Sony Mdr-xb950b1 Extra Bass, ¡sellado! ",549,NA,0,3,NA,NA,NA,Entrega a acordar con el vendedor,NA,NA,NA,NA,http://perfil.mercadolibre.com.pe/EZYSTEM,https://articulo.mercadolibre.com.pe/MPE-429405648-audifonos-bluetooth-sony-mdr-xb950b1-extra-bass-sellado-_JM,NA,NA,NA,NA,NA,#429405648,NA,NA,NA,NA
552, Audifonos Bluetooth Sport Tipo Beats By De iPhone Calidad ,120,NA,1,19,NA,NA,NA,Entrega a acordar con el vendedor,NA,NA,NA,NA,http://perfil.mercadolibre.com.pe/VIER8936936,https://articulo.mercadolibre.com.pe/MPE-425789510-audifonos-bluetooth-sport-tipo-beats-by-de-iphone-calidad-_JM,NA,NA,NA,NA,NA,#425789510,Skullcandy,NA,NA,NA
553," Mini Audífono Bluetooth-503 ,radio ,sd ",44,NA,3,97,NA,NA,NA,Entrega a acordar con el vendedor,NA,NA,NA,NA,http://perfil.mercadolibre.com.pe/EL+RINCONDELCOCO,https://articulo.mercadolibre.com.pe/MPE-428557233-mini-audifono-bluetooth-503-radio-sd-_JM,NA,NA,NA,NA,NA,#428557233,NA,NA,NA,NA
554, Audifonos Bluetooth Maxell Eb-bt100 smoke Smartphone Tablet ,69,NA,3,2,NA,NA,NA,Entrega a acordar con el vendedor,NA,NA,NA,NA,http://perfil.mercadolibre.com.pe/PERUSTEC,https://articulo.mercadolibre.com.pe/MPE-433941964-audifonos-bluetooth-maxell-eb-bt100smoke-smartphone-tablet-_JM,NA,NA,NA,NA,NA,#433941964,Maxell,NA,NA,NA
555, Audifonos Ewtto Bluetooth Et-a4662b Exelentes ,42,NA,1,4,NA,NA,NA,Entrega a acordar con el vendedor,NA,NA,NA,NA,http://perfil.mercadolibre.com.pe/LIZANDRIAN15,https://articulo.mercadolibre.com.pe/MPE-428214070-audifonos-ewtto-bluetooth-et-a4662b-exelentes-_JM,NA,NA,NA,NA,NA,#428214070,Ewtto,NA,NA,NA
556, Creazy Mini Bluetooth Inalambrico Gemelos Estereo Audifonos ,185,NA,0,12,NA,NA,NA,Entrega a acordar con el vendedor,NA,NA,NA,NA,http://perfil.mercadolibre.com.pe/NEGOCIOS+DANTE1920,https://articulo.mercadolibre.com.pe/MPE-436364839-creazy-mini-bluetooth-inalambrico-gemelos-estereo-audifonos-_JM,NA,NA,NA,NA,NA,#436364839,CREAZYDOG,NA,NA,NA
557, Audífonos Bluetooth Motorola Pulse Escape Original / Tienda ,145,NA,33,972,NA,NA,NA,Entrega a acordar con el vendedor,NA,NA,4.8,18,http://perfil.mercadolibre.com.pe/IMANIA.PERU,https://articulo.mercadolibre.com.pe/MPE-429010800-audifonos-bluetooth-motorola-pulse-escape-original-tienda-_JM,15,3,0,0,0,#429010800,Motorola,Pulse,Pulse Escape,NA
558, Huawei Sport Lite Audífonos Bluetooth Inalambricos Original ,189,NA,0,2,NA,NA,NA,Entrega a acordar con el vendedor,NA,NA,NA,NA,http://perfil.mercadolibre.com.pe/ELECTRO-FIX.,https://articulo.mercadolibre.com.pe/MPE-433447578-huawei-sport-lite-audifonos-bluetooth-inalambricos-original-_JM,NA,NA,NA,NA,NA,#433447578,Huawei,NA,NA,NA
559, Audífono Bluetooth Modelo S530 Llamada Y Música ,19,NA,12,16,NA,NA,NA,Entrega a acordar con el vendedor,NA,NA,NA,NA,http://perfil.mercadolibre.com.pe/JENNIFERROCCA,https://articulo.mercadolibre.com.pe/MPE-428078227-audifono-bluetooth-modelo-s530-llamada-y-musica-_JM,NA,NA,NA,NA,NA,#428078227,NA,NA,NA,NA
560, Bose Audifonos Soundlink Modelo Ae Serie Ii Bluetooth Negro ,1199,NA,NA,56,NA,NA,NA,Entrega a acordar con el vendedor,NA,NA,NA,NA,http://perfil.mercadolibre.com.pe/GWYICHANGYCIASATO?brandId=133,https://articulo.mercadolibre.com.pe/MPE-434071451-bose-audifonos-soundlink-modelo-ae-serie-ii-bluetooth-negro-_JM,NA,NA,NA,NA,NA,#434071451,Bose,NA,AroundEar,NA
561, Audifono Bluetooth - Havit ,49,NA,0,2,NA,NA,NA,Entrega a acordar con el vendedor,NA,NA,NA,NA,http://perfil.mercadolibre.com.pe/JUANUGARRIZA,https://articulo.mercadolibre.com.pe/MPE-434864239-audifono-bluetooth-havit-_JM,NA,NA,NA,NA,NA,#434864239,NA,NA,NA,NA
562, P Audifono Skullcandy Uproar Bluetooth Wireless Con Micrófon ,139,NA,17,1,NA,NA,NA,Entrega a acordar con el vendedor,NA,NA,NA,NA,http://perfil.mercadolibre.com.pe/INTECGLOBALPERU,https://articulo.mercadolibre.com.pe/MPE-424926405-p-audifono-skullcandy-uproar-bluetooth-wireless-con-microfon-_JM,NA,NA,NA,NA,NA,#424926405,Skullcandy,NA,Uproar,Over-ear
563, Pioneer Audifonos Bluetooth Supraurales For Rich Sound ,189,NA,1,9,NA,NA,NA,Entrega a acordar con el vendedor,NA,NA,NA,NA,http://perfil.mercadolibre.com.pe/FULL+NOVEDADES-,https://articulo.mercadolibre.com.pe/MPE-435493037-pioneer-audifonos-bluetooth-supraurales-for-rich-sound-_JM,NA,NA,NA,NA,NA,#435493037,Pioneer,NA,NA,NA
564, Audifonos Samsung Galaxy Buds 2019 Bluetooth - Mercado Pago ,529,603,0,100,NA,NA,NA,Entrega a acordar con el vendedor,NA,NA,NA,NA,http://perfil.mercadolibre.com.pe/TECHNOW+1,https://articulo.mercadolibre.com.pe/MPE-436797721-audifonos-samsung-galaxy-buds-2019-bluetooth-mercado-pago-_JM,NA,NA,NA,NA,NA,#436797721,Samsung,Galaxy,Buds,In-ear
565, Audifonos Con Bluetooth ,39,NA,0,2,NA,NA,NA,Envío gratis a todo el país,NA,NA,NA,NA,http://perfil.mercadolibre.com.pe/CITELS,https://articulo.mercadolibre.com.pe/MPE-428011063-audifonos-con-bluetooth-_JM,NA,NA,NA,NA,NA,#428011063,NA,NA,NA,NA
566, Audifonos AirPods De Apple 1era Gen Como Nuevo ,490,NA,0,NA,NA,NA,NA,Entrega a acordar con el vendedor,NA,NA,5,40,http://perfil.mercadolibre.com.pe/PERU+TRADING,https://articulo.mercadolibre.com.pe/MPE-436723695-audifonos-airpods-de-apple-1era-gen-como-nuevo-_JM,38,2,0,0,0,#436723695,Apple,NA,AirPods,In-ear
567, Transmisor Emisor Bluetooth Optico Escucha Tv En Audifonos ,115,NA,1,9,NA,NA,NA,Entrega a acordar con el vendedor,NA,NA,NA,NA,http://perfil.mercadolibre.com.pe/MIPASC,https://articulo.mercadolibre.com.pe/MPE-436082610-transmisor-emisor-bluetooth-optico-escucha-tv-en-audifonos-_JM,NA,NA,NA,NA,NA,#436082610,NA,NA,NA,NA
568, Audífono Bluetooth Extra Bass Bt-830 ,45,NA,0,NA,NA,NA,NA,Entrega a acordar con el vendedor,NA,NA,NA,NA,http://perfil.mercadolibre.com.pe/DAKSHOP,https://articulo.mercadolibre.com.pe/MPE-433223386-audifono-bluetooth-extra-bass-bt-830-_JM,NA,NA,NA,NA,NA,#433223386,NA,NA,NA,NA
569, Mini Auricular Bluetooth I7s Tws + Caja // Earpods Y AirPods ,54,NA,0,NA,NA,NA,NA,Entrega a acordar con el vendedor,NA,NA,NA,NA,http://perfil.mercadolibre.com.pe/IMPORTACIONES+AMAC,https://articulo.mercadolibre.com.pe/MPE-435919246-mini-auricular-bluetooth-i7s-tws-caja-earpods-y-airpods-_JM,NA,NA,NA,NA,NA,#435919246,NA,NA,NA,NA
570, Audífonos Bluetooth Sony Mdr-xb950b1 Usado ,300,NA,0,NA,NA,NA,NA,Entrega a acordar con el vendedor,NA,NA,NA,NA,http://perfil.mercadolibre.com.pe/ALL-IN-LUC,https://articulo.mercadolibre.com.pe/MPE-436523182-audifonos-bluetooth-sony-mdr-xb950b1-usado-_JM,NA,NA,NA,NA,NA,#436523182,NA,NA,NA,NA
571, Apple AirPods Audifonos Bluetooth iPhone X 8 Plus Original ,760,NA,3,3,NA,NA,NA,Entrega a acordar con el vendedor,NA,NA,5,40,http://perfil.mercadolibre.com.pe/MYJ+C%C3%81NEPANEGOCIOS,https://articulo.mercadolibre.com.pe/MPE-433272557-apple-airpods-audifonos-bluetooth-iphone-x-8-plus-original-_JM,38,2,0,0,0,#433272557,Apple,NA,AirPods,In-ear
572, Audifonos Bluetooth Ergonomicos / 5 Horas De Duracion ,40,NA,0,NA,NA,NA,NA,Entrega a acordar con el vendedor,NA,NA,NA,NA,http://perfil.mercadolibre.com.pe/HANNZOTIENDAONLINE,https://articulo.mercadolibre.com.pe/MPE-436111474-audifonos-bluetooth-ergonomicos-5-horas-de-duracion-_JM,NA,NA,NA,NA,NA,#436111474,NA,NA,NA,NA
573, Audifonos Bluetooh Samsung Gear Iconx ,250,NA,1,NA,NA,NA,NA,Entrega a acordar con el vendedor,NA,NA,NA,NA,http://perfil.mercadolibre.com.pe/ATOCONGOMULTISERVICE,https://articulo.mercadolibre.com.pe/MPE-434092092-audifonos-bluetooh-samsung-gear-iconx-_JM,NA,NA,NA,NA,NA,#434092092,Samsung,Gear,IconX,In-ear
574, Audifonos I7s Plus Bluetooth 5.0 Inalambricos Rosa Gold ,64,NA,0,50,NA,NA,NA,Entrega a acordar con el vendedor,NA,NA,NA,NA,http://perfil.mercadolibre.com.pe/HUMA7820320,https://articulo.mercadolibre.com.pe/MPE-436847216-audifonos-i7s-plus-bluetooth-50-inalambricos-rosa-gold-_JM,NA,NA,NA,NA,NA,#436847216,NA,NA,NA,NA
