search_position,name,curr_price,orig_price,num_sold,in_stock,num_installments,amt_installments,arrival_time,shipping,free_return,free_return_info,review_avg,num_reviews,seller_link,product_link,five_star,four_star,three_star,two_star,one_star,item_id,Marca,Línea,Modelo,Formato
1001," Auriculares Inalambricos Con Bluetooth, Estereo, Ipx7, Imper ",171,NA,0,12,NA,NA,NA,Entrega a acordar con el vendedor,NA,NA,NA,NA,http://perfil.mercadolibre.com.pe/NEGOCIOS+DANTE1920,https://articulo.mercadolibre.com.pe/MPE-436365408-auriculares-inalambricos-con-bluetooth-estereo-ipx7-imper-_JM,NA,NA,NA,NA,NA,#436365408,VISLLA,NA,NA,NA
1002, Gratis!!! Audífono Philips Shb4305 Bass+ Bluetooth 4.1 ,149,NA,0,NA,NA,NA,NA,Envío gratis a todo el país,NA,NA,NA,NA,http://perfil.mercadolibre.com.pe/INTECGLOBALPERU,https://articulo.mercadolibre.com.pe/MPE-435618234-gratis-audifono-philips-shb4305-bass-bluetooth-41-_JM,NA,NA,NA,NA,NA,#435618234,Philips,BASS+,NA,NA
1003, Audifonos Deportivos Bluetooth Inalámbricos Radio Sd Iblue ,75,NA,0,NA,NA,NA,NA,Entrega a acordar con el vendedor,NA,NA,NA,NA,http://perfil.mercadolibre.com.pe/JOSE+GOGOME,https://articulo.mercadolibre.com.pe/MPE-436394156-audifonos-deportivos-bluetooth-inalambricos-radio-sd-iblue-_JM,NA,NA,NA,NA,NA,#436394156,NA,NA,NA,NA
1004, Audifonos Anker Soundbuds Slim Bluetooth 4.1 - Water Resista ,119,NA,0,4,NA,NA,NA,Entrega a acordar con el vendedor,NA,NA,NA,NA,http://perfil.mercadolibre.com.pe/KINGOFTECH,https://articulo.mercadolibre.com.pe/MPE-433400199-audifonos-anker-soundbuds-slim-bluetooth-41-water-resista-_JM,NA,NA,NA,NA,NA,#433400199,Anker,SoundBuds,NA,NA
1005, Auriculares Bluetooth Waterproof Ipx7 Auriculares Inalambric ,161,NA,0,12,NA,NA,NA,Entrega a acordar con el vendedor,NA,NA,NA,NA,http://perfil.mercadolibre.com.pe/NEGOCIOS+DANTE1920,https://articulo.mercadolibre.com.pe/MPE-436366024-auriculares-bluetooth-waterproof-ipx7-auriculares-inalambric-_JM,NA,NA,NA,NA,NA,#436366024,Cool Wind,NA,MQ31,NA
1006, Audifonos Bluetooth Xiaomi Airdots Pro Original 2019 ,220,NA,0,8,NA,NA,NA,Entrega a acordar con el vendedor,NA,NA,4.2,5,http://perfil.mercadolibre.com.pe/MIPASC,https://articulo.mercadolibre.com.pe/MPE-435601503-audifonos-bluetooth-xiaomi-airdots-pro-original-2019-_JM,4,0,0,0,1,#435601503,Xiaomi,iPhone,Airdots Pro,NA
1007, Hands Free Auricular Inalámbrico Bluetooth Motorola G7 Plus ,69,NA,0,2,NA,NA,NA,Entrega a acordar con el vendedor,NA,NA,NA,NA,http://perfil.mercadolibre.com.pe/MACMELLOWMIRAFLORES,https://articulo.mercadolibre.com.pe/MPE-436409272-hands-free-auricular-inalambrico-bluetooth-motorola-g7-plus-_JM,NA,NA,NA,NA,NA,#436409272,NA,NA,NA,NA
1008, Auriculares Bluetooth Auriculares Inalambricos Teeck Deporte ,220,NA,0,12,NA,NA,NA,Entrega a acordar con el vendedor,NA,NA,NA,NA,http://perfil.mercadolibre.com.pe/NEGOCIOS+DANTE1920,https://articulo.mercadolibre.com.pe/MPE-436366194-auriculares-bluetooth-auriculares-inalambricos-teeck-deporte-_JM,NA,NA,NA,NA,NA,#436366194,TEECK,NA,ZT-B,NA
1009, Audifono Bluetooth Motorola Verve Loop+ Original Sellado ,168,NA,0,19,NA,NA,NA,Entrega a acordar con el vendedor,NA,NA,5,2,http://perfil.mercadolibre.com.pe/NOTEPHONE_2013,https://articulo.mercadolibre.com.pe/MPE-434274473-audifono-bluetooth-motorola-verve-loop-original-sellado-_JM,2,0,0,0,0,#434274473,Motorola,NA,VerveLoop,In-ear
1010, Audifonos Pioneer Bluetooth Mj553bt ,195,NA,6,3,NA,NA,NA,Entrega a acordar con el vendedor,NA,NA,NA,NA,http://perfil.mercadolibre.com.pe/MYJ+C%C3%81NEPANEGOCIOS,https://articulo.mercadolibre.com.pe/MPE-431875609-audifonos-pioneer-bluetooth-mj553bt-_JM,NA,NA,NA,NA,NA,#431875609,Pioneer,NA,NA,NA
1011, Motorola Audifonos Bluetooth Verve Loop Plus Deportivos Ip57 ,159,NA,0,NA,NA,NA,NA,Entrega a acordar con el vendedor,NA,NA,5,2,http://perfil.mercadolibre.com.pe/FULL+NOVEDADES-,https://articulo.mercadolibre.com.pe/MPE-435243434-motorola-audifonos-bluetooth-verve-loop-plus-deportivos-ip57-_JM,2,0,0,0,0,#435243434,Motorola,NA,VerveLoop,In-ear
1012, Sinfonizado Drv Madera Genuina Bluetooth Auriculares Inalamb ,234,NA,0,12,NA,NA,NA,Entrega a acordar con el vendedor,NA,NA,NA,NA,http://perfil.mercadolibre.com.pe/NEGOCIOS+DANTE1920,https://articulo.mercadolibre.com.pe/MPE-436366261-sinfonizado-drv-madera-genuina-bluetooth-auriculares-inalamb-_JM,NA,NA,NA,NA,NA,#436366261,SYMPHONIZED,NA,NA,NA
1013, Audifonos Y Receptor De Bluetooth R8 Movisun ,63,NA,1,5,NA,NA,NA,Entrega a acordar con el vendedor,NA,NA,NA,NA,NA,https://articulo.mercadolibre.com.pe/MPE-436208420-audifonos-y-receptor-de-bluetooth-r8-movisun-_JM,NA,NA,NA,NA,NA,#436208420,NA,NA,NA,NA
1014, Mini I11s Audífonos Bluetooth Tipo AirPods P/apple Y Android ,54,NA,0,10,NA,NA,NA,Entrega a acordar con el vendedor,NA,NA,5,40,http://perfil.mercadolibre.com.pe/VRB+EIRL,https://articulo.mercadolibre.com.pe/MPE-435844724-mini-i11s-audifonos-bluetooth-tipo-airpods-papple-y-android-_JM,38,2,0,0,0,#435844724,Apple,NA,AirPods,In-ear
1015, Audífonos Bluetooth Sony Xb950b1 / Extra Bass / Nuevo Tienda ,599,NA,0,8,NA,NA,NA,Entrega a acordar con el vendedor,NA,NA,NA,NA,http://perfil.mercadolibre.com.pe/RAGIMPORT,https://articulo.mercadolibre.com.pe/MPE-432640104-audifonos-bluetooth-sony-xb950b1-extra-bass-nuevo-tienda-_JM,NA,NA,NA,NA,NA,#432640104,Sony,NA,NA,NA
1016, Audifono Xiaomi Redmi Airdots Original Stock Disponible ,88,NA,0,50,NA,NA,NA,Entrega a acordar con el vendedor,NA,NA,4.6,85,http://perfil.mercadolibre.com.pe/TECMI.STORE,https://articulo.mercadolibre.com.pe/MPE-437382351-audifono-xiaomi-redmi-airdots-original-stock-disponible-_JM,58,23,4,0,0,#437382351,Xiaomi,Audifonos Bluetooth,Redmi AirDots,Headset
1017, Soundpeats Auriculares Inalambricos Magneticos Con Bluetooth ,231,NA,0,12,NA,NA,NA,Entrega a acordar con el vendedor,NA,NA,NA,NA,http://perfil.mercadolibre.com.pe/NEGOCIOS+DANTE1920,https://articulo.mercadolibre.com.pe/MPE-436787895-soundpeats-auriculares-inalambricos-magneticos-con-bluetooth-_JM,NA,NA,NA,NA,NA,#436787895,SoundPEATS,NA,NA,NA
1018," Audifonos Bluetooth Mini 503 / Android, iPhone, Llamadas, Fm ",42,NA,0,25,NA,NA,NA,Entrega a acordar con el vendedor,NA,NA,NA,NA,http://perfil.mercadolibre.com.pe/ZONATECPER%C3%9A,https://articulo.mercadolibre.com.pe/MPE-432381042-audifonos-bluetooth-mini-503-android-iphone-llamadas-fm-_JM,NA,NA,NA,NA,NA,#432381042,NA,NA,NA,NA
1019, Mini Audifonos I9s Bluetooth Diseñ0 AirPods ,87,NA,1,14,NA,NA,NA,Entrega a acordar con el vendedor,NA,NA,NA,NA,NA,https://articulo.mercadolibre.com.pe/MPE-432423713-mini-audifonos-i9s-bluetooth-disen0-airpods-_JM,NA,NA,NA,NA,NA,#432423713,NA,NA,NA,NA
1020, Audífonos Bluetooth Maxell 347777 Eb-bt100 Solid ,85,NA,1,4,NA,NA,NA,Entrega a acordar con el vendedor,NA,NA,NA,NA,NA,https://articulo.mercadolibre.com.pe/MPE-433448049-audifonos-bluetooth-maxell-347777-eb-bt100-solid-_JM,NA,NA,NA,NA,NA,#433448049,Maxell,NA,NA,NA
1021, Audifonos Inalámbricos Stereo Bluetooth B11 Baseus ,84,NA,0,10,NA,NA,NA,Envío gratis a todo el país,NA,NA,NA,NA,http://perfil.mercadolibre.com.pe/IMPORTACIONES+OSRO,https://articulo.mercadolibre.com.pe/MPE-435485084-audifonos-inalambricos-stereo-bluetooth-b11-baseus-_JM,NA,NA,NA,NA,NA,#435485084,NA,NA,NA,NA
1022, Audifónos Inálambricos I9s -tws Bluetooth 5.0 ,79,NA,0,NA,NA,NA,NA,Entrega a acordar con el vendedor,NA,NA,NA,NA,http://perfil.mercadolibre.com.pe/LOTECH+SOLUTIONS,https://articulo.mercadolibre.com.pe/MPE-436984978-audifonos-inalambricos-i9s-tws-bluetooth-50-_JM,NA,NA,NA,NA,NA,#436984978,NA,NA,NA,NA
1023, Audifonos Motorola Moto Boom 2 Wireless ,165,NA,2,3,NA,NA,NA,Entrega a acordar con el vendedor,NA,NA,NA,NA,http://perfil.mercadolibre.com.pe/MYJ+C%C3%81NEPANEGOCIOS,https://articulo.mercadolibre.com.pe/MPE-427422451-audifonos-motorola-moto-boom-2-wireless-_JM,NA,NA,NA,NA,NA,#427422451,Motorola,Moto,NA,NA
1024, Tebaurry Auriculares Inalámbricos Bluetooth Led (a Pedido) ,185,NA,0,NA,NA,NA,NA,Entrega a acordar con el vendedor,NA,NA,NA,NA,http://perfil.mercadolibre.com.pe/JACKJIMNEZVIAS,https://articulo.mercadolibre.com.pe/MPE-437412851-tebaurry-auriculares-inalambricos-bluetooth-led-a-pedido-_JM,NA,NA,NA,NA,NA,#437412851,NA,NA,NA,NA
1025, Mini I9s Audífonos Bluetooth Diseño AirPods ,80,NA,0,100,NA,NA,NA,Entrega a acordar con el vendedor,NA,NA,5,40,http://perfil.mercadolibre.com.pe/BREMOTT,https://articulo.mercadolibre.com.pe/MPE-436211069-mini-i9s-audifonos-bluetooth-diseno-airpods-_JM,38,2,0,0,0,#436211069,Apple,NA,AirPods,In-ear
1026, Jbl Audifonos Bluetooth Metal Pure Bass Duet Mini2 Wireless ,199,NA,0,20,NA,NA,NA,Entrega a acordar con el vendedor,NA,NA,NA,NA,http://perfil.mercadolibre.com.pe/FULL+NOVEDADES-,https://articulo.mercadolibre.com.pe/MPE-436319079-jbl-audifonos-bluetooth-metal-pure-bass-duet-mini2-wireless-_JM,NA,NA,NA,NA,NA,#436319079,JBL,NA,NA,NA
1027, P Audífono Panasonic Rp-nj300 Bluetooth 4.1 ,149,NA,0,NA,NA,NA,NA,Entrega a acordar con el vendedor,NA,NA,NA,NA,http://perfil.mercadolibre.com.pe/INTECGLOBALPERU,https://articulo.mercadolibre.com.pe/MPE-433116579-p-audifono-panasonic-rp-nj300-bluetooth-41-_JM,NA,NA,NA,NA,NA,#433116579,Panasonic,NA,NA,NA
1028, Mini Audifonos Bluetooh Llamada Musica Colores Auricular ,39,NA,0,30,NA,NA,NA,Entrega a acordar con el vendedor,NA,NA,NA,NA,http://perfil.mercadolibre.com.pe/LATINO+ESPIA,https://articulo.mercadolibre.com.pe/MPE-431638702-mini-audifonos-bluetooh-llamada-musica-colores-auricular-_JM,NA,NA,NA,NA,NA,#431638702,NA,NA,NA,NA
1029, Audifonos Panasonic Bluetooth Rp Hf400 ,165,NA,3,3,NA,NA,NA,Entrega a acordar con el vendedor,NA,NA,NA,NA,http://perfil.mercadolibre.com.pe/MYJ+C%C3%81NEPANEGOCIOS,https://articulo.mercadolibre.com.pe/MPE-429793508-audifonos-panasonic-bluetooth-rp-hf400-_JM,NA,NA,NA,NA,NA,#429793508,Panasonic,NA,RP-HF400,NA
1030, Gratis!!! Audífono Lg Hbs-a100 Tone Active+ Premium Bluetoot ,494,NA,0,2,NA,NA,NA,Envío gratis a todo el país,NA,NA,NA,NA,http://perfil.mercadolibre.com.pe/INTECGLOBALPERU,https://articulo.mercadolibre.com.pe/MPE-434091962-gratis-audifono-lg-hbs-a100-tone-active-premium-bluetoot-_JM,NA,NA,NA,NA,NA,#434091962,LG,NA,NA,NA
1031, Audifonos Deportivo Xo Bluetooth Bs5 ,70,NA,0,NA,NA,NA,NA,Entrega a acordar con el vendedor,NA,NA,NA,NA,http://perfil.mercadolibre.com.pe/IMQU8972250,https://articulo.mercadolibre.com.pe/MPE-434209397-audifonos-deportivo-xo-bluetooth-bs5-_JM,NA,NA,NA,NA,NA,#434209397,NA,NA,NA,NA
1032, Audifono Bluetooth Samsung Level U Azul Original Sellado Ofe ,180,NA,0,30,NA,NA,NA,Entrega a acordar con el vendedor,NA,NA,NA,NA,http://perfil.mercadolibre.com.pe/EXPRESO.BBC,https://articulo.mercadolibre.com.pe/MPE-422650672-audifono-bluetooth-samsung-level-u-azul-original-sellado-ofe-_JM,NA,NA,NA,NA,NA,#422650672,Samsung,Level,NA,NA
1033, Nuevos Audífonos I9s Tws Bluetooth Tipo Airpods ,110,NA,0,10,NA,NA,NA,Envío gratis a todo el país,NA,NA,NA,NA,http://perfil.mercadolibre.com.pe/TOPECELPERU,https://articulo.mercadolibre.com.pe/MPE-435805509-nuevos-audifonos-i9s-tws-bluetooth-tipo-airpods-_JM,NA,NA,NA,NA,NA,#435805509,NA,NA,NA,NA
1034, Auriculares Bluetooth Hoco Es20 Con Control Táctil ,260,NA,0,NA,NA,NA,NA,Entrega a acordar con el vendedor,NA,NA,NA,NA,http://perfil.mercadolibre.com.pe/LUCIANATZ,https://click1.mercadolibre.com.pe/mclics/clicks/external/MPE/count?a=wYTvcBfy%2FhQGDXUOQinq2lBsTMKkVPdeodoqXwvU25YnLFyvtTzICZj%2FrS3OCCjH9luyX5HONWi9SpH%2BXKs0i5A2S6xFLb3nozLZbj3Hgm%2B%2FoPtEZUYveb67YnFrMsPIX3s%2FisrGiHW1WqndY8EFOAih%2BOUCBRAH2HhZ04g9RFt3cNg1UoCDAMVqB0hdTjvJBPFkVjxcpS2bPnLQyz35nA73bkva5oEN7BvsZvcYwiXRJr1dLV2zNHHS8M278uCnHWJ%2FGp22GqBnouNWSZBe98yQia7JqjuWpP8tetX1ViuzyUv1xMOIANqQzTi6B3BRqjrXDRYSfsF6W0F6Oc2G6MT7RCXd%2Bvs%2FSN3yNS8%2F3DHD%2Bv6aA97o%2FChxHTxgPOsQ5lf5zqeyu64K6DXJ9Man2RrrpnQeKhUmJNdTgSPJKgQIGZZQ9AJF24aDkt0Wb1tY4uD7mDQCSdb6yTHKlu8RI2DcLSdC2Q9dcUbZn6wHjUR1y6IUwQdpczvh%2Bs6sU87GYyvt9wpC8AuPQ%2BTPYn0AZS3hT%2B1pjuzYX8yfKOfsDJWOXjb5MnksKFxfTxxKEqXq1H0mtfA%2BOGhm94mqeE9KOWT7xtj%2BlU0hKOQYeKL40njesogXt8RW%2FeG3Zpw69Oz3qnGhFmkMvu%2Fx3nDs31grTRNAspLiIG%2Bn0MVk2q66AWDqzkESRoaTzjoaHs0f25ziHfuQ%2FW2FSI5gZ7SSp3i5i8GgjDMO%2F7tg3qKLnBHQMd3L6Vp%2FvdvkcABzoH%2B1w%2BEbPg1wXFYwcqJF8bsQi0w5wR7SK%2BJfLgJYn0im175YpJ2yjnDY8vNTSQywQ9iRwMeHFbs9msGce8fF5HEaPtQ9VautzYqnw6C7%2F7lE9cE1eG7g1chn01ftWskVSrAm4f3soPlIcVHum34XnKdI9IPKvAJ%2F31GWueCViCoryKOlYsYwncisAJUPy4mIkIih5M8KnFrR4C%2FQZpIcMd17nfq5UsD%2FTPTcGCkkhwpUwqUV29arUyloG1pcLsaeVBRSIbWi%2B%2Bc24AUsZ5W9FLEl7l4rW9Y%2BaHX2b2kuZ44yDaaVsg2Cj%2F7O6WYoy6nFlj9MMTuSI7zCR1%2B%2FL5Kdcj5i5QlDuyN8AQfKS%2BJJgE5MhOZLQB%2F0snrEpu8Bc5wFup73Ak9B8uhUG5uWQ%2BQaFWSjjckpES45VUUgkmRzeZaHYprT2%2BrhfNnC9FjXqcHxAIfr6%2Fr2KyQ%2BIZwte%2F%2Flm3VBuT42AI1d4AsplMHT6U1WaSZKDBUJEtEFVRgYQX3EtboMS4%2FMHubrnm7ymRyzkbtvA3v0mnCof7IbsoFnlkGy%2BMygT3l%2B0rfj3PP%2BMrCzJ%2FgHoz3cF8tRs7Fz3cDM1x9SMUjuaGfk7yYLU1sgcFlyaEAsB%2B8BLqWftUMso5zXjPLTyLcmvAf%2BBJlLW4GK8IthWSK471j1%2BB206P91jZ0A55kdkIQWK2FAqmpi3oEJSOAz5zKOMe%2FS1jP6%2BhEVzBKqH%2FZ%2FqYAqEwExZ2EByyIlv1U6ZkrCRyCSI2hKEEeG%2Bo9FDbCG1PQIHd%2FQ08QiVg16cqQrmHXGsgbURyEr43api5Npaj%2B5SiROtAeKzp4xSchajiSJLPU9UyRIPttUSAB5lWkx4VdWjGM9VKhcuorpzG%2B%2B,NA,NA,NA,NA,NA,#437431728,NA,NA,NA,NA
1035, Audifono Bluetooth Samsung U Flex Earphones Original Sellado ,259,NA,0,17,NA,NA,NA,Entrega a acordar con el vendedor,NA,NA,5,1,http://perfil.mercadolibre.com.pe/NOTEPHONE_2013,https://articulo.mercadolibre.com.pe/MPE-434211879-audifono-bluetooth-samsung-u-flex-earphones-original-sellado-_JM,1,0,0,0,0,#434211879,Samsung,NA,U Flex,Neckband
1036, Audifonos Bluetooth Jbl E25bt ,220,NA,5,NA,NA,NA,NA,Entrega a acordar con el vendedor,NA,NA,NA,NA,http://perfil.mercadolibre.com.pe/ADVANCEL+ACCESORIOS,https://articulo.mercadolibre.com.pe/MPE-429246248-audifonos-bluetooth-jbl-e25bt-_JM,NA,NA,NA,NA,NA,#429246248,JBL,NA,E25BT,NA
1037, Mini I9s Audifonos Bluetooth Diseñ0 AirPods ,87,NA,1,9,NA,NA,NA,Entrega a acordar con el vendedor,NA,NA,NA,NA,NA,https://articulo.mercadolibre.com.pe/MPE-432419292-mini-i9s-audifonos-bluetooth-disen0-airpods-_JM,NA,NA,NA,NA,NA,#432419292,NA,NA,NA,NA
1038, Audifonos Originales I13 ,150,NA,0,1,NA,NA,NA,Envío gratis a todo el país,NA,NA,NA,NA,http://perfil.mercadolibre.com.pe/ROSE_2019,https://articulo.mercadolibre.com.pe/MPE-436790755-audifonos-originales-i13-_JM,NA,NA,NA,NA,NA,#436790755,i13,NA,DS-i13-TWS,NA
1039, Audifonos Skullcandy Bluetooth Jib Wireless Supreme Sound ,80,NA,0,NA,NA,NA,NA,Entrega a acordar con el vendedor,NA,NA,NA,NA,NA,https://articulo.mercadolibre.com.pe/MPE-436798744-audifonos-skullcandy-bluetooth-jib-wireless-supreme-sound-_JM,NA,NA,NA,NA,NA,#436798744,NA,NA,NA,NA
1040, P Audífono Motorola Verve Loop 200 Deportivo Bluetooth 4.2 ,159,NA,0,NA,NA,NA,NA,Entrega a acordar con el vendedor,NA,NA,5,2,http://perfil.mercadolibre.com.pe/INTECGLOBALPERU,https://articulo.mercadolibre.com.pe/MPE-435467783-p-audifono-motorola-verve-loop-200-deportivo-bluetooth-42-_JM,2,0,0,0,0,#435467783,Motorola,NA,VerveLoop,In-ear
1041," Audifono Bluetooth Handsfree, Auricular, Microusb Y Control ",24,NA,0,50,NA,NA,NA,Entrega a acordar con el vendedor,NA,NA,NA,NA,http://perfil.mercadolibre.com.pe/FENIXIMPORTPERUX,https://articulo.mercadolibre.com.pe/MPE-436633088-audifono-bluetooth-handsfree-auricular-microusb-y-control-_JM,NA,NA,NA,NA,NA,#436633088,NA,NA,NA,NA
1042, Auriculares Xiaomi Mi Airdots Wireless Bluetooth_delivery ,170,NA,0,10,NA,NA,NA,Entrega a acordar con el vendedor,NA,NA,4.6,85,http://perfil.mercadolibre.com.pe/CARLOSAVENDANO15,https://articulo.mercadolibre.com.pe/MPE-436734429-auriculares-xiaomi-mi-airdots-wireless-bluetoothdelivery-_JM,58,23,4,0,0,#436734429,Xiaomi,Mi,AirDots,In-ear
1043, Audifonos Bluebeats Bluetooth Con Microfono Incluido Y Sd ,140,NA,1,NA,NA,NA,NA,Entrega a acordar con el vendedor,NA,NA,NA,NA,http://perfil.mercadolibre.com.pe/NANDOXSM,https://articulo.mercadolibre.com.pe/MPE-426191430-audifonos-bluebeats-bluetooth-con-microfono-incluido-y-sd-_JM,NA,NA,NA,NA,NA,#426191430,NA,NA,NA,NA
1044, Audifonos Bluetooth Stereo Tipo Sony Xb50 Microsd + Delivery ,75,NA,0,50,NA,NA,NA,Entrega a acordar con el vendedor,NA,NA,NA,NA,http://perfil.mercadolibre.com.pe/FENIXIMPORTPERUX,https://articulo.mercadolibre.com.pe/MPE-436639614-audifonos-bluetooth-stereo-tipo-sony-xb50-microsd-delivery-_JM,NA,NA,NA,NA,NA,#436639614,NA,NA,NA,NA
1045, Audifono Bluetooth De Alta Calidad Mini 970 Movisun ,50,NA,0,NA,NA,NA,NA,Entrega a acordar con el vendedor,NA,NA,NA,NA,http://perfil.mercadolibre.com.pe/DAKSHOP,https://articulo.mercadolibre.com.pe/MPE-435203125-audifono-bluetooth-de-alta-calidad-mini-970-movisun-_JM,NA,NA,NA,NA,NA,#435203125,NA,NA,NA,NA
1046, Auricular Audifono Manos Libres Bluetooth V9 Inalambrico ,80,NA,1,99,NA,NA,NA,Entrega a acordar con el vendedor,NA,NA,NA,NA,NA,https://articulo.mercadolibre.com.pe/MPE-435914164-auricular-audifono-manos-libres-bluetooth-v9-inalambrico-_JM,NA,NA,NA,NA,NA,#435914164,NA,NA,NA,NA
1047, Audífonos Inalambrico Bluetooth Xiaomi Samsung Iphon Htc Lg ,79,NA,1,39,NA,NA,NA,Entrega a acordar con el vendedor,NA,NA,NA,NA,http://perfil.mercadolibre.com.pe/NABYSSHOPPER%C3%9A,https://articulo.mercadolibre.com.pe/MPE-430095994-audifonos-inalambrico-bluetooth-xiaomi-samsung-iphon-htc-lg-_JM,NA,NA,NA,NA,NA,#430095994,Xiaomi,NA,NA,NA
1048, Audifonos Bluetooth Inalambrico 4en1 Radio Micro Sd ,89,NA,3,NA,NA,NA,NA,Entrega a acordar con el vendedor,NA,NA,NA,NA,http://perfil.mercadolibre.com.pe/CSHOP1,https://articulo.mercadolibre.com.pe/MPE-431028938-audifonos-bluetooth-inalambrico-4en1-radio-micro-sd-_JM,NA,NA,NA,NA,NA,#431028938,NA,NA,NA,NA
1049, Audífonos Philips Bluetooth Shb4205 Flite Vibración ,150,NA,1,3,NA,NA,NA,Entrega a acordar con el vendedor,NA,NA,NA,NA,http://perfil.mercadolibre.com.pe/MYJ+C%C3%81NEPANEGOCIOS,https://articulo.mercadolibre.com.pe/MPE-432633118-audifonos-philips-bluetooth-shb4205-flite-vibracion-_JM,NA,NA,NA,NA,NA,#432633118,Philips,NA,NA,NA
1050, Audifonos Bluetooth Deportivos Headset Inalambrico Gift ,34,NA,0,5,NA,NA,NA,Entrega a acordar con el vendedor,NA,NA,NA,NA,http://perfil.mercadolibre.com.pe/OSRA6692680,https://articulo.mercadolibre.com.pe/MPE-436755038-audifonos-bluetooth-deportivos-headset-inalambrico-gift-_JM,NA,NA,NA,NA,NA,#436755038,Skill,NA,ISC,NA
1051, Audifonos Xiaomi Airdots Tws Bluetooth Auricular. ,95,NA,1,9,NA,NA,NA,Entrega a acordar con el vendedor,NA,NA,NA,NA,NA,https://articulo.mercadolibre.com.pe/MPE-436739027-audifonos-xiaomi-airdots-tws-bluetooth-auricular-_JM,NA,NA,NA,NA,NA,#436739027,Xiaomi,NA,AirDots,NA
1052, Gratis!!! Audífono Bluetooth Motorola Pulse Escape+ ,169,NA,0,2,NA,NA,NA,Envío gratis a todo el país,NA,NA,4.7,13,http://perfil.mercadolibre.com.pe/INTECGLOBALPERU,https://articulo.mercadolibre.com.pe/MPE-434120813-gratis-audifono-bluetooth-motorola-pulse-escape-_JM,9,4,0,0,0,#434120813,Motorola,NA,Pulse Escape+,Over-ear
1053, Audífonos Handfree Bluetooth Hbs760 ,49,NA,3,2,NA,NA,NA,Entrega a acordar con el vendedor,NA,NA,NA,NA,http://perfil.mercadolibre.com.pe/SMARTSHOPI,https://articulo.mercadolibre.com.pe/MPE-424293341-audifonos-handfree-bluetooth-hbs760-_JM,NA,NA,NA,NA,NA,#424293341,NA,NA,NA,NA
1054, Audifonos Earphones Lightning Tipo Con Función Bluetooth ,44,NA,0,5,NA,NA,NA,Entrega a acordar con el vendedor,NA,NA,NA,NA,http://perfil.mercadolibre.com.pe/BCACCESORIOSSTORE,https://articulo.mercadolibre.com.pe/MPE-435171199-audifonos-earphones-lightning-tipo-con-funcion-bluetooth-_JM,NA,NA,NA,NA,NA,#435171199,Apple,NA,NA,NA
1055, Audifonos Inalambrios Bluetooth Imantados Deportivos 2018 ,27,NA,0,54,NA,NA,NA,Entrega a acordar con el vendedor,NA,NA,NA,NA,http://perfil.mercadolibre.com.pe/ZONATECPER%C3%9A,https://articulo.mercadolibre.com.pe/MPE-437057284-audifonos-inalambrios-bluetooth-imantados-deportivos-2018-_JM,NA,NA,NA,NA,NA,#437057284,NA,NA,NA,NA
1056," Audifono Bluetooth P47, Radio Fm, Micro Sd, Handsfree. ",38,NA,0,100,NA,NA,NA,Entrega a acordar con el vendedor,NA,NA,NA,NA,http://perfil.mercadolibre.com.pe/GUAN4681344,https://articulo.mercadolibre.com.pe/MPE-436374943-audifono-bluetooth-p47-radio-fm-micro-sd-handsfree-_JM,NA,NA,NA,NA,NA,#436374943,NA,NA,NA,NA
1057, Guarda Protege Y Carga X10 Tus Audífonos Bluetooth Mycharge ,120,NA,0,NA,NA,NA,NA,Envío gratis a todo el país,NA,NA,NA,NA,http://perfil.mercadolibre.com.pe/JAVIERZINHO77,https://articulo.mercadolibre.com.pe/MPE-434487497-guarda-protege-y-carga-x10-tus-audifonos-bluetooth-mycharge-_JM,NA,NA,NA,NA,NA,#434487497,NA,NA,NA,NA
1058, Audifonos Bluetooth Sony Mdr Xb650bt Bass ,430,NA,0,2,NA,NA,NA,Entrega a acordar con el vendedor,NA,NA,NA,NA,http://perfil.mercadolibre.com.pe/OSCAR-MANUEL,https://articulo.mercadolibre.com.pe/MPE-433492233-audifonos-bluetooth-sony-mdr-xb650bt-bass-_JM,NA,NA,NA,NA,NA,#433492233,NA,NA,NA,NA
1059, Audífono Bluetooth Deportivo Bateria 10 Horas - Movisun ,54,NA,2,90,NA,NA,NA,Entrega a acordar con el vendedor,NA,NA,NA,NA,http://perfil.mercadolibre.com.pe/TODATECNOLOGIAPERU.COM.,https://articulo.mercadolibre.com.pe/MPE-422921043-audifono-bluetooth-deportivo-bateria-10-horas-movisun-_JM,NA,NA,NA,NA,NA,#422921043,Movisun,movisun,S07,NA
1060," Auriculares Inalambricos Con Bluetooth 4.1, Con Diseño De D ",225,NA,0,12,NA,NA,NA,Entrega a acordar con el vendedor,NA,NA,NA,NA,http://perfil.mercadolibre.com.pe/NEGOCIOS+DANTE1920,https://articulo.mercadolibre.com.pe/MPE-436364413-auriculares-inalambricos-con-bluetooth-41-con-diseno-de-d-_JM,NA,NA,NA,NA,NA,#436364413,EGRD,NA,NA,NA
1061, Audifono Bluetooth Jbl E25bt Original Sellado Oferta ,274,NA,0,17,NA,NA,NA,Envío gratis a todo el país,NA,NA,NA,NA,http://perfil.mercadolibre.com.pe/NOTEPHONE_2013,https://articulo.mercadolibre.com.pe/MPE-434210783-audifono-bluetooth-jbl-e25bt-original-sellado-oferta-_JM,NA,NA,NA,NA,NA,#434210783,JBL,E-Series,E25BT,In-ear
1062, Jbl Audifonos Everest Elite 750nc Bluetooth ,920,NA,0,3,NA,NA,NA,Entrega a acordar con el vendedor,NA,NA,NA,NA,http://perfil.mercadolibre.com.pe/MYJ+C%C3%81NEPANEGOCIOS,https://articulo.mercadolibre.com.pe/MPE-435275112-jbl-audifonos-everest-elite-750nc-bluetooth-_JM,NA,NA,NA,NA,NA,#435275112,JBL,NA,Elite 750NC,NA
1063, Audífono Bluetooth Klip Xtreme Deportivo Khs-634yl Amarillo ,139,NA,0,3,NA,NA,NA,Entrega a acordar con el vendedor,NA,NA,NA,NA,http://perfil.mercadolibre.com.pe/PERU_DE_SHOPPING,https://articulo.mercadolibre.com.pe/MPE-431733540-audifono-bluetooth-klip-xtreme-deportivo-khs-634yl-amarillo-_JM,NA,NA,NA,NA,NA,#431733540,Klip Xtreme,NA,NA,NA
1064, Auriculares Inalambricos Bluetooth Con Microfono De Pop Desi ,249,NA,0,12,NA,NA,NA,Entrega a acordar con el vendedor,NA,NA,NA,NA,http://perfil.mercadolibre.com.pe/NEGOCIOS+DANTE1920,https://articulo.mercadolibre.com.pe/MPE-436365218-auriculares-inalambricos-bluetooth-con-microfono-de-pop-desi-_JM,NA,NA,NA,NA,NA,#436365218,Pop,NA,POP-BTIP7X,NA
1065, Audifonos Inalambricos AirPods I7s Bluetooth Apple Y Android ,40,NA,1,19,NA,NA,NA,Entrega a acordar con el vendedor,NA,NA,NA,NA,NA,https://articulo.mercadolibre.com.pe/MPE-436782568-audifonos-inalambricos-airpods-i7s-bluetooth-apple-y-android-_JM,NA,NA,NA,NA,NA,#436782568,TWS,Inalambricos,i7S,In-ear
1066, Audifonos Bluetooth Jbl E45bt / Tienda / Mercadopago ,329,NA,0,98,NA,NA,NA,Entrega a acordar con el vendedor,NA,NA,NA,NA,http://perfil.mercadolibre.com.pe/IMANIA.PERU,https://articulo.mercadolibre.com.pe/MPE-435473373-audifonos-bluetooth-jbl-e45bt-tienda-mercadopago-_JM,NA,NA,NA,NA,NA,#435473373,JBL,NA,E45BT,NA
1067, Zerwey Auriculares Bluetooth Mejor Auriculares Deportivos In ,262,NA,0,12,NA,NA,NA,Entrega a acordar con el vendedor,NA,NA,NA,NA,http://perfil.mercadolibre.com.pe/NEGOCIOS+DANTE1920,https://articulo.mercadolibre.com.pe/MPE-436365348-zerwey-auriculares-bluetooth-mejor-auriculares-deportivos-in-_JM,NA,NA,NA,NA,NA,#436365348,ZERWEY,NA,BT100,NA
1068, Audifono Inalambrico Gutsyman ,22,NA,0,NA,NA,NA,NA,Entrega a acordar con el vendedor,NA,NA,NA,NA,http://perfil.mercadolibre.com.pe/MROSASD,https://articulo.mercadolibre.com.pe/MPE-436042475-audifono-inalambrico-gutsyman-_JM,NA,NA,NA,NA,NA,#436042475,NA,NA,NA,NA
1069, Audifonos Xiaomi Airdots Tws Bluetooth Auricular. ,98,NA,0,5,NA,NA,NA,Entrega a acordar con el vendedor,NA,NA,4.6,85,NA,https://articulo.mercadolibre.com.pe/MPE-437218282-audifonos-xiaomi-airdots-tws-bluetooth-auricular-_JM,58,23,4,0,0,#437218282,Xiaomi,NA,AirDots,NA
1070, Audifono Bluetooth Hd Blitzwolf® Bw-bh1 Llamadas Y Música ,70,NA,0,8,NA,NA,NA,Envío gratis a todo el país,NA,NA,NA,NA,http://perfil.mercadolibre.com.pe/ETERNITY-S,https://articulo.mercadolibre.com.pe/MPE-436845659-audifono-bluetooth-hd-blitzwolf-bw-bh1-llamadas-y-musica-_JM,NA,NA,NA,NA,NA,#436845659,BlitzWolf,Hands Free,BW-BH1,NA
1071, Soundpeats Auriculares Bluetooth Ipx7 Auriculares Deportivos ,192,NA,0,12,NA,NA,NA,Entrega a acordar con el vendedor,NA,NA,NA,NA,http://perfil.mercadolibre.com.pe/NEGOCIOS+DANTE1920,https://articulo.mercadolibre.com.pe/MPE-436787961-soundpeats-auriculares-bluetooth-ipx7-auriculares-deportivos-_JM,NA,NA,NA,NA,NA,#436787961,SoundPEATS,NA,NA,NA
1072, Audifono Bluetooth Oferta! Lider Oferta ,10,NA,1,19,NA,NA,NA,Entrega a acordar con el vendedor,NA,NA,NA,NA,NA,https://articulo.mercadolibre.com.pe/MPE-436039420-audifono-bluetooth-oferta-lider-oferta-_JM,NA,NA,NA,NA,NA,#436039420,NA,NA,NA,NA
1073, Audifonos Bluetooth Samsung Level U Wireless S6 S7 S7 Edge ,149,NA,0,14,NA,NA,NA,Entrega a acordar con el vendedor,NA,NA,5,1,http://perfil.mercadolibre.com.pe/FULL+NOVEDADES-,https://articulo.mercadolibre.com.pe/MPE-436526392-audifonos-bluetooth-samsung-level-u-wireless-s6-s7-s7-edge-_JM,1,0,0,0,0,#436526392,Samsung,Level,U Wireless,Neckband
1074, Audifonos Bluetooth Jbl E25bt - Negro ,199,NA,0,2,NA,NA,NA,Entrega a acordar con el vendedor,NA,NA,NA,NA,http://perfil.mercadolibre.com.pe/DOMIZI-MEDIA,https://articulo.mercadolibre.com.pe/MPE-436457024-audifonos-bluetooth-jbl-e25bt-negro-_JM,NA,NA,NA,NA,NA,#436457024,JBL,NA,E25BT,NA
